crate,downloads,recent_downloads,created_at,updated_at,max_version,description,repository
gix-merge,13447.0,6324.0,2024-10-22T19:03:15.646736Z,2025-04-04T02:21:08.800282Z,0.4.0,A crate of the gitoxide project implementing merge algorithms,https://github.com/GitoxideLabs/gitoxide
gix-negotiate,7108332.0,1910160.0,2023-05-19T09:17:15.337392Z,2025-04-04T02:21:21.218080Z,0.19.0,A crate of the gitoxide project implementing negotiation algorithms,https://github.com/GitoxideLabs/gitoxide
gix-protocol,6995994.0,2160589.0,2023-02-17T09:50:40.985063Z,2025-04-04T02:23:07.310380Z,0.49.0,A crate of the gitoxide project for implementing git protocols,https://github.com/GitoxideLabs/gitoxide
gix-revision,9610153.0,2399924.0,2023-02-17T09:50:54.201104Z,2025-04-04T02:20:50.766244Z,0.33.0,A crate of the gitoxide project dealing with finding names for revisions and parsing specifications,https://github.com/GitoxideLabs/gitoxide
gix-revwalk,8847485.0,2404663.0,2023-06-10T09:03:44.566624Z,2025-04-04T02:04:12.226147Z,0.19.0,A crate providing utilities for walking the revision graph,https://github.com/GitoxideLabs/gitoxide
gix-status,765345.0,467813.0,2023-09-24T18:17:39.063152Z,2025-04-04T02:23:22.955720Z,0.18.0,A crate of the gitoxide project dealing with 'git status'-like functionality,https://github.com/GitoxideLabs/gitoxide
gix-traverse,9686619.0,2415125.0,2023-02-17T09:47:07.686827Z,2025-04-04T02:04:26.744809Z,0.45.0,A crate of the gitoxide project,https://github.com/GitoxideLabs/gitoxide
jj-cli,36139.0,11598.0,2023-07-16T21:03:00.963411Z,2025-04-07T15:51:17.226627Z,0.28.2,Jujutsu - an experimental version control system,https://github.com/jj-vcs/jj
apollo-compiler,310830.0,45070.0,2022-07-27T17:09:44.886992Z,2025-03-04T13:46:36.356580Z,1.27.0,A compiler for the GraphQL query language.,https://github.com/apollographql/apollo-rs
tauri-plugin-shell,792789.0,295512.0,2023-05-24T20:36:00.493906Z,2025-04-02T03:33:57.018160Z,2.2.1,Access the system shell. Allows you to spawn child processes and manage files and URLs using their default application.,https://github.com/tauri-apps/plugins-workspace
